session	filename	transcript	speaker	image	original_transcrippt
20230325-161026-551	461.wav	おかわりは頼まないの？	Kawano	00000003/00003540.jpg	おかわりは頼まないの？
20230325-161026-551	462.wav	もう2cmほど削ったほうがいいな。	Kawano	00000059/00059391.jpg	もう2cmほど削ったほうがいいな。
20230325-161026-551	463.wav	この鍛え具合どうですか？	Kawano	00000029/00029646.jpg	この鍛え具合どうですか？
20230325-161026-551	464.wav	うわぁドライアイスがスゴイ！	Kawano	00000097/00097525.jpg	うわぁドライアイスがスゴイ！おしゃれね。
20230325-161026-551	466.wav	難しく見えるだろうが、基本は自動運転だよ。	Kawano	00000056/00056101.jpg	難しく見えるだろうが、基本は自動運転だよ。
20230325-161026-551	467.wav	弾いてみるから、曲名を当ててみて。	Kawano	00000062/00062579.jpg	弾いてみるから、曲名を当ててみて。
20230325-161026-551	468.wav	レポート終わんないよ	Kawano	00000052/00052124.jpg	レポート終わんないよ
20230325-161026-551	469.wav	ダイブだ！	Kawano	00000040/00040664.jpg	ダイブだ！
20230325-161026-551	470.wav	みなさんありがとう	Kawano	00000012/00012672.jpg	みなさんありがとう
20230325-161026-551	471.wav	いいから仕事しろよ	Kawano	00000007/00007907.jpg	いいから仕事しろよ
20230325-161026-551	472.wav	どこで料理の勉強をしたかって？	Kawano	00000066/00066840.jpg	どこで料理の勉強したかって？「服部幸應専門学校」だよ？知ってるだろ？有名だもんな。
20230325-161026-551	476.wav	点滴はあと何分？	Kawano	00000072/00072238.jpg	点滴はあと何分？
20230325-161026-551	477.wav	私、財布をどのポケットに入れたか覚えてない？	Kawano	00000109/00109776.jpg	私、財布をどのポケットに入れたか覚えてない？
20230325-161026-551	478.wav	参ったよ、今日の売上はじゅぎょう従業員の給料を払ったら赤字だ。	Kawano	00000056/00056148.jpg	参ったよ、今月の売上では従業員の給料を払ったら赤字だ。
20230325-161026-551	479.wav	釘で打ち付ける前にえ糊付けするときれいにしあが仕上がるんです	Kawano	00000040/00040285.jpg	釘で打ち付ける前に糊付けするときれいに仕上がるんです
20230325-161026-551	480.wav	厨房狭いでしょう？	Kawano	00000066/00066833.jpg	厨房狭いでしょう？
20230325-161026-551	481.wav	飛びます跳びます	Kawano	00000101/00101985.jpg	飛びます跳びます
20230325-161026-551	482.wav	それでは15ページを開いて下さい。	Kawano	00000043/00043023.jpg	それでは15ページを開いて下さい。
20230325-161026-551	483.wav	うまい肉だから包んであげるよ	Kawano	00000049/00049231.jpg	うまい肉だから包んであげるよ
20230325-161026-551	484.wav	論文を書き終えるまでそっとしておいてください	Kawano	00000043/00043432.jpg	論文を書き終えるまでそっとしておいてください
20230325-161026-551	485.wav	この黄色いローブって何に使うんですか？	Kawano	00000048/00048532.jpg	この黄色いロープって何に使うんですか？
20230325-161026-551	486.wav	丸の位置に足を合わせるの？	Kawano	00000076/00076117.jpg	丸の位置に足を合わせるの？
20230325-161026-551	489.wav	明日の会議をー成功させなくっちゃいけないから、準備をちゃんとやっておかないといけないんですよ。	Kawano	00000096/00096891.jpg	明日の会議は成功させなくっちゃいけないから、準備をちゃんとやっておかないといけないんですよ。
20230325-161026-551	490.wav	ピース。	Kawano	00000096/00096817.jpg	ピース。
20230325-161026-551	491.wav	通路を塞いでしまってごめんなさい。	Kawano	00000012/00012601.jpg	通路を塞いでしまってごめんなさい。
20230325-161026-551	492.wav	おもてなしよ	Kawano	00000073/00073024.jpg	おもてなしよ
20230325-161026-551	493.wav	ご利用ありがとうございました。	Kawano	00000099/00099165.jpg	ご利用ありがとうございました。
20230325-161026-551	496.wav	トイレに並べるのを手伝ってくださる？	Kawano	00000077/00077266.jpg	トレイに並べるのを手伝ってくださる？
20230325-161026-551	500.wav	後は個人のセンスによって模様などを付けていきます。	Kawano	00000029/00029347.jpg	後は個人のセンスによって模様などを付けていきます。
20230325-161026-551	503.wav	みんなの昼ごはんを写真に撮ろうよ。	Kawano	00000012/00012555.jpg	みんなの昼ごはんを写真に撮ろうよ。
20230325-161026-551	504.wav	うりゃー	Kawano	00000036/00036393.jpg	うりゃー
20230325-161026-551	505.wav	今日も私のトーク聴いてくれてありがとう。	Kawano	00000088/00088214.jpg	今日も私のトーク聴いてくれてありがとう。
20230325-161026-551	506.wav	使い込んでんだろ？	Kawano	00000083/00083001.jpg	使い込んでるだろ
20230325-161026-551	507.wav	赤い口紅イケてるでしょう？	Kawano	00000055/00055298.jpg	赤い口紅イケてるでしょう？
20230325-161026-551	508.wav	この向きで貼り付けるのがいいと思うけど、どう？	Kawano	00000070/00070097.jpg	この向きで貼り付けるのがいいと思うけど、どう？
20230325-161026-551	509.wav	服装は自由なの	Kawano	00000087/00087880.jpg	服装は自由なの
20230325-161026-551	510.wav	あれで見やすくなったでしょ？	Kawano	00000058/00058953.jpg	あれで見やすくなったでしょ？
20230325-161026-551	511.wav	よし着地は上々。	Kawano	00000114/00114227.jpg	よし着地は上々。後ろはまだ着いて来ないわよね。
20230325-161026-551	513.wav	こども服は、どれを選ぼうかな。	Kawano	00000028/00028428.jpg	こども服は、どれを選ぼうかな。
20230325-161026-551	514.wav	そろそろ暗くなりそうだから帰る用意するよ。	Kawano	00000103/00103998.jpg	そろそろ暗くなりそうだから帰る用意するよ。
20230325-161026-551	515.wav	これくらいは全然平気ですよ	Kawano	00000059/00059420.jpg	これくらいは全然平気ですよ
20230325-161026-551	516.wav	この奥にアクセサリを仕舞ったはずなんだけど	Kawano	00000055/00055176.jpg	この奥にアクセサリを仕舞ったはずなんだけど見つからないわ。
20230325-161026-551	518.wav	音響機材の操作が間に合わないよ。	Kawano	00000084/00084666.jpg	音響機材の操作が間に合わないよ。
20230325-161026-551	519.wav	一気飲みだよ	Kawano	00000022/00022024.jpg	一気飲みだよ
20230325-161026-551	520.wav	ただいまの時間から店内商品全て20％オフです。	Kawano	00000032/00032092.jpg	ただいまの時間から店内商品全て20％オフです。
20230325-161026-551	521.wav	うぎゃー	Kawano	00000072/00072529.jpg	んぎゃー
20230325-161026-551	522.wav	誓います	Kawano	00000022/00022635.jpg	誓います
20230325-161026-551	524.wav	レシートの枚数が足りないよ。	Kawano	00000028/00028590.jpg	いまのところ計算の合計は出てるけれど、レシートの枚数が足りないのよ。
20230325-161026-551	525.wav	脂身は取り除きます。	Kawano	00000048/00048683.jpg	脂身は取り除きます。
20230325-161026-551	528.wav	お見舞いに来てくれてありがとう。	Kawano	00000006/00006378.jpg	お見舞いに来てくれてありがとう。
20230325-161026-551	529.wav	どのキーを押せばいいの？	Kawano	00000004/00004026.jpg	どのキーを押せばいいの？
20230325-161026-551	532.wav	雑誌を買ってきてくれてありがとう。	Kawano	00000072/00072950.jpg	雑誌を買ってきてくれてありがとう。
20230325-161026-551	533.wav	色んな惣菜あるけど買わないかい？	Kawano	00000079/00079157.jpg	色んな惣菜あるけど買わないかい？
20230325-161026-551	534.wav	スケートボートを返すのはこうやってやるの。	Kawano	00000011/00011168.jpg	スケートボートを返すのはこうやってやるの。
20230325-161026-551	535.wav	こんばんは	Kawano	00000096/00096771.jpg	こんばんは
20230325-161026-551	536.wav	メッチャ美味いよ	Kawano	00000011/00011750.jpg	メッチャ美味いよ
20230325-161026-551	537.wav	シケた顔してるでしょ？	Kawano	00000020/00020838.jpg	シケた顔してるでしょ？
20230325-161026-551	538.wav	明日のプランたてようか？	Kawano	00000062/00062469.jpg	明日のプランたてようか？
20230325-161026-551	541.wav	では、自己紹介させていただきます。	Kawano	00000026/00026379.jpg	では、自己紹介させていただきます。
20230325-161026-551	542.wav	ふんわり浮いている感じで頼むよ	Kawano	00000019/00019240.jpg	ふんわり浮いている感じで頼むよ
20230325-161026-551	543.wav	ちょっと。こんな高そうなレストラン来て大丈夫なの？	Kawano	00000097/00097732.jpg	ちょっと。こんな高そうなレストラン来て大丈夫なの？
20230325-161026-551	544.wav	いい？始めるよ？	Kawano	00000038/00038044.jpg	いい？始めるよ？
20230325-161026-551	545.wav	がんばれ！	Kawano	00000113/00113668.jpg	がんばれ！
20230325-161026-551	550.wav	マズくはないよ	Kawano	00000012/00012110.jpg	マズくはないよ
20230325-161026-551	551.wav	テレビを観てるの	Kawano	00000004/00004383.jpg	テレビを観てるの
20230325-161026-551	552.wav	このパソコンだけソフトがインストールできなかったから、ちょっと見てくれないか？	Kawano	00000008/00008764.jpg	このパソコンだけソフトがインストールできなから、ちょっと見てくれないか？
20230325-161026-551	553.wav	スポークが折れてたんだよね	Kawano	00000001/00001713.jpg	スポークが折れてたんだよね
20230325-161026-551	554.wav	お勧めですよ。	Kawano	00000032/00032102.jpg	お勧めですよ。
20230325-161026-551	555.wav	文化祭に何をするか話合いましょ。	Kawano	00000028/00028443.jpg	文化祭に何をするか話合いましょ。
20230325-161026-551	556.wav	私が捕まえた泥棒の事件のってるわ	Kawano	00000022/00022522.jpg	私が捕まえた泥棒の事件のってるわ
20230325-161026-551	557.wav	走りますね。	Kawano	00000114/00114038.jpg	走りますね。
20230325-161026-551	558.wav	今日は僕が片付ける日なんだ。	Kawano	00000076/00076479.jpg	今日は僕が片付ける日なんだ。
20230325-161026-551	559.wav	コーナーは菌が溜まりやすいので	Kawano	00000076/00076738.jpg	コーナーは菌が溜まりやすいので念入りに散布しましょう。
20230325-161026-551	560.wav	念入りにー散布しましょう。	Kawano	00000017/00017040.jpg	今日はタバコを何本吸ったか数えてみるよ。
20230325-161026-551	563.wav	画像を送るから待って。	Kawano	00000003/00003756.jpg	画像を送るから待って。
20230325-161026-551	564.wav	本日の料理はダイエット向けのこくらメニューです。	Kawano	00000076/00076808.jpg	本日の料理はダイエット向けの小食メニューです。
20230325-161026-551	565.wav	私のラッキーカラーは黒です。	Kawano	00000040/00040966.jpg	私のラッキーカラーは黒です。
20230325-161026-551	566.wav	あなたは何故私に付いてくるのですか？	Kawano	00000060/00060087.jpg	あなたは何故私に付いてくるのですか？
20230325-161026-551	567.wav	最後にこいつをのせるんだ。	Kawano	00000099/00099125.jpg	最後にこいつをのせるんだ。
20230325-161026-551	568.wav	オーダーは初めてですか。	Kawano	00000101/00101678.jpg	オーダーは初めてですか。
20230325-161026-551	569.wav	一時しのぎの補修だけど、何とか頑張るよ。	Kawano	00000001/00001626.jpg	一時しのぎの補修だけど、何とか頑張るよ。
20230325-161026-551	570.wav	先にご飯食べますよ。	Kawano	00000050/00050270.jpg	先にご飯食べますよ。
20230325-161026-551	571.wav	ミキサーでかき混ぜたら次は鍋で煮るんだよ	Kawano	00000016/00016250.jpg	ミキサーでかき混ぜたら次は鍋で煮るんだ
20230325-161026-551	572.wav	まず、右の正拳を入れる。そして、	Kawano	00000081/00081005.jpg	まず、右の正拳を入れる。そして、
20230325-161026-551	573.wav	該当の資料はデーターベース上にはないようです。	Kawano	00000087/00087903.jpg	該当の資料はデーターベース上にはないようです。
20230325-161026-551	575.wav	近未来っぽくみえる？	Kawano	00000088/00088542.jpg	どう近未来っぽくみえる？
20230325-161026-551	576.wav	すみませんが、研究室では撮影するのはご遠慮ください。	Kawano	00000002/00002283.jpg	すみませんが、研究室では撮影するのはご遠慮ください。
20230325-161026-551	577.wav	この中から好きなものを選んじゃって良いのですか？	Kawano	00000012/00012787.jpg	この中から好きなものを選んじゃって良いのですか？
20230325-161026-551	578.wav	夕しゃくの仕度をしています。	Kawano	00000076/00076978.jpg	夕飯の仕度をしています。
20230325-161026-551	579.wav	イスの配置はこのあたりでよいのかしら？	Kawano	00000022/00022083.jpg	イスの配置はこのあたりでよいかしら？
20230325-161026-551	580.wav	キャンドルいっぱいでしょう	Kawano	00000087/00087029.jpg	キャンドルいっぱいでしょう
20230325-161026-551	583.wav	ここに植えればいいの?	Kawano	00000002/00002025.jpg	ここに植えればいいの?
20230325-161026-551	584.wav	どこまで、あの選手は投げるかな？	Kawano	00000114/00114257.jpg	どこまで、あの選手は投げるかな？。
20230325-161026-551	587.wav	本物そっくりでしょ	Kawano	00000029/00029177.jpg	本物そっくりでしょ
20230325-161026-551	588.wav	めんどくさい	Kawano	00000020/00020260.jpg	めんどくさい
20230325-161026-551	589.wav	子供たちはこういうパズルを使ってアルファベットを覚えるんですよー	Kawano	00000087/00087445.jpg	子供たちはこういうパズルを使ってアルファベットを覚えるんですよ
20230325-161026-551	590.wav	自力で身体を動かすことが出来るかちょっと見ていてください。	Kawano	00000070/00070330.jpg	自力で身体を動かすことが出来るかちょっと見ていてください。
20230325-161026-551	591.wav	雨が降りそうだから早めに広げたよ。	Kawano	00000103/00103395.jpg	雨が降りそうだから早めに広げたよ。商品が濡れたらたいへんだからね。
20230325-161026-551	593.wav	フラインぎグディスクとったどー。	Kawano	00000007/00007293.jpg	フライングディスクとったどー。
20230325-161026-551	594.wav	デザートにはこのスイカをお持ちします。	Kawano	00000097/00097694.jpg	デザートにはこのスイカをお持ちします。
20230325-161026-551	595.wav	わかったわかった、起きるから大声出さないで	Kawano	00000062/00062611.jpg	わかったわかった、起きるから大声出さないで
20230325-161026-551	596.wav	ほーら、かわいくできたでしょ	Kawano	00000032/00032061.jpg	ほーら、かわいくできたでしょ
20230325-161026-551	597.wav	両手で混ぜるから早いよ。	Kawano	00000005/00005066.jpg	両手で混ぜるから早いよ。
20230325-161026-551	598.wav	粘土で遊びますよ。	Kawano	00000052/00052890.jpg	粘土で遊びます。
20230325-161026-551	599.wav	地味な工程でしょ？	Kawano	00000066/00066717.jpg	地味な工程でしょ？
20230325-161026-551	600.wav	食器洗い手伝うよ	Kawano	00000004/00004198.jpg	食器洗い手伝うよ？
20230325-161026-551	602.wav	君も話し合いに参加したら？	Kawano	00000119/00119120.jpg	おーい、君も話し合いに参加したら？
20230325-161026-551	603.wav	キャー噛まれたわ	Kawano	00000068/00068323.jpg	キャー噛まれたわ助けてー、なんてね
20230325-161026-551	605.wav	美味しそうな匂いがしてきたでしょ？	Kawano	00000015/00015315.jpg	美味しそうな匂いがしてきたでしょ？
20230325-161026-551	606.wav	いぇ〜い	Kawano	00000037/00037357.jpg	いぇ～い
20230325-161026-551	607.wav	生ハムはお好きですか。	Kawano	00000097/00097315.jpg	生ハムはお好きですか。どうぞ食べてみて下さい。
20230325-161026-551	609.wav	今から、微調整するから	Kawano	00000040/00040142.jpg	今から、微調整するから
20230325-161026-551	610.wav	案外暖かいでしょ	Kawano	00000074/00074722.jpg	案外暖かいでしょ
20230325-161026-551	611.wav	このテープで固定しておきましょう。	Kawano	00000022/00022901.jpg	このテープで固定しておきましょう。
20230325-161026-551	612.wav	すこし、お待ちください。	Kawano	00000089/00089407.jpg	すこし、お待ちください。
20230325-161026-551	613.wav	ドライバーで飛ばすよ	Kawano	00000064/00064234.jpg	ドライバーで飛ばすよ？
20230325-161026-551	614.wav	タレに絡めると本当にあまき甘みが増しておいしい。	Kawano	00000065/00065677.jpg	タレに絡めると本当に甘みが増しておいしい。
20230325-161026-551	615.wav	それでこのレシートの代金は誰が払うのですか？	Kawano	00000010/00010871.jpg	それでこのレシートの代金は誰が払うのですか？
20230325-161026-551	616.wav	タバコがしけっちまうのよー。	Kawano	00000017/00017040.jpg	タバコがしけっちまうよー。
20230325-161026-551	617.wav	先ずは腹ごしらえよ	Kawano	00000073/00073065.jpg	先ずは腹ごしらえよ
20230325-161026-551	618.wav	よおく火にかざすのです。	Kawano	00000036/00036606.jpg	よおく火にかざすのです。
20230325-161026-551	619.wav	異常なーし！	Kawano	00000032/00032316.jpg	異常なし！
20230325-161026-551	622.wav	胸の事はほっといて下さい。セクハラですよ。	Kawano	00000089/00089130.jpg	胸の事はほっといて下さい。セクハラですよ。
20230325-161026-551	623.wav	しっかりつかまっていろよ！	Kawano	00000095/00095389.jpg	しっかりつかまっていろよ！
20230325-161026-551	625.wav	乾いたら色付けよ	Kawano	00000030/00030557.jpg	乾いたら色付けよ
20230325-161026-551	627.wav	今日は僕のDJで盛り上がるよ。	Kawano	00000036/00036580.jpg	今日は僕のDJで盛り上げるぞ。
20230325-161026-551	628.wav	僕の今までの練習の成果を聴いておくれ	Kawano	00000043/00043965.jpg	僕の今までの練習の成果を聴いておくれ
20230325-161026-551	629.wav	揚げたてのフライを食べてみる？	Kawano	00000017/00017385.jpg	揚げたてのフライを食べてみる？
20230325-161026-551	630.wav	カメラにおさめておきます	Kawano	00000083/00083466.jpg	カメラにおさめておきます
20230325-161026-551	631.wav	ぴーす！	Kawano	00000072/00072666.jpg	ぴーす！
20230325-161026-551	632.wav	焼きそば食べてかない？	Kawano	00000000/00000645.jpg	焼きそば食べてかない？
20230325-161026-551	633.wav	君もタバコ吸いたいならあげるよ	Kawano	00000003/00003508.jpg	君もタバコ吸いたいならあげるよ
20230325-161026-551	634.wav	へぇ、そうなんですか？	Kawano	00000112/00112138.jpg	へぇ、そうなんですか？
20230325-161026-551	635.wav	じゃあ入刀しますよ	Kawano	00000011/00011088.jpg	じゃあ入刀しますよ
20230325-161026-551	636.wav	えへへ、おいしい	Kawano	00000090/00090523.jpg	へへへ、おいしー
20230325-161026-551	637.wav	採取した組織を顕微鏡で観察します。	Kawano	00000002/00002229.jpg	採取した組織を顕微鏡で観察します。
20230325-161026-551	638.wav	ジャーンプ	Kawano	00000114/00114549.jpg	ジャーンプ
20230325-161026-551	639.wav	誕生日ケーキ用意してくれてどうもありがとう。	Kawano	00000014/00014592.jpg	誕生日ケーキを用意してくれてどうもありがとう。
20230325-161026-551	640.wav	上手に弾けているでしょ？	Kawano	00000086/00086217.jpg	上手に弾けているでしょ？
20230325-161026-551	641.wav	ブロッコリは嫌だ。	Kawano	00000009/00009376.jpg	ブロッコリは嫌だ。
20230325-161026-551	644.wav	これテレビなの？私映るの？	Kawano	00000004/00004948.jpg	コレテレビなの？私映るの？
20230325-161026-551	649.wav	サイズはこれでよかった？	Kawano	00000055/00055198.jpg	サイズはこれでよかった？
20230325-161026-551	650.wav	テントを立てるのを、手伝ってもらえませんか？	Kawano	00000050/00050330.jpg	テントを立てるのを、手伝ってもらえませんか？
20230325-161026-551	651.wav	きまった！	Kawano	00000011/00011060.jpg	きまった！
20230325-161026-551	652.wav	きゃっ倒れる	Kawano	00000054/00054559.jpg	きゃっ倒れる
20230325-161026-551	653.wav	海賊よ。	Kawano	00000051/00051281.jpg	海賊よ。
20230325-161026-551	654.wav	どれにしょうかしら？	Kawano	00000055/00055329.jpg	どれにしょうかしら？
20230325-161026-551	657.wav	チアーズ！	Kawano	00000097/00097598.jpg	チアーズ！
20230325-161026-551	658.wav	絵の具の上から固着剤を塗るんですよ	Kawano	00000074/00074228.jpg	絵の具の上から固着剤を塗るんですよ
20230325-161026-551	659.wav	料理を作ってもらったらいお礼に、皿洗いをするよ。	Kawano	00000004/00004287.jpg	料理を作ってもらったお礼に、皿洗いをするよ。
20230325-161026-551	661.wav	生地を薄く延ばします。	Kawano	00000099/00099886.jpg	麺棒を水平に転がして生地を薄く延ばします。
20230325-161026-551	662.wav	これ、アルコール度数いくつ？	Kawano	00000013/00013906.jpg	これ、アルコール度数いくつ！
20230325-161026-551	663.wav	そいつをやればいいの？	Kawano	00000037/00037170.jpg	そいつをやればいいの？
20230325-161026-551	664.wav	中々できないので、連絡してる所です。	Kawano	00000006/00006859.jpg	中々来ないので、連絡している所です。
20230325-161026-551	665.wav	3Gのプログラムをこれから動かしてみるんだけれどやってみますか？	Kawano	00000008/00008182.jpg	3Ｄのプログラムをこれから動かしてみるのだけれど見てみますか？
20230325-161026-551	666.wav	やあ、おはよう	Kawano	00000056/00056515.jpg	やあ、おはよう
20230325-161026-551	667.wav	旅の記録をその都度書き留めるのよ	Kawano	00000004/00004726.jpg	旅の記録をその都度書き留めるのよ
20230325-161026-551	668.wav	野菜やすいかをカットしてぽりぶくポリ箱に入れましょう。	Kawano	00000052/00052899.jpg	野菜やすいかをカットしてポリ箱に入れましょう。
20230325-161026-551	669.wav	次、負けたら、交代するよ。	Kawano	00000019/00019296.jpg	次、負けたら、交代するよ。
20230325-161026-551	673.wav	ドールのいしょう衣装作りはハマると凝ってしまうんですよ。	Kawano	00000061/00061961.jpg	ドールの衣装作りはハマると凝ってしまうんですよ。
20230325-161026-551	674.wav	セクシーでしょ	Kawano	00000027/00027137.jpg	セクシーでしょ
20230325-161026-551	675.wav	いっぱいかくの？	Kawano	00000027/00027818.jpg	いっぱいかくの
20230325-161026-551	679.wav	えーっとごめんなさいな、磨くと見違えるわ	Kawano	00000051/00051032.jpg	ごらんなさいな、磨くと見違えるわ
20230325-161026-551	680.wav	綺麗なお花でしょ？	Kawano	00000077/00077406.jpg	綺麗な花でしょ？
20230325-161026-551	682.wav	戦場でも息抜きは大事だぞ。	Kawano	00000116/00116020.jpg	お前もこっちに来いよ、戦場でも息抜きは大事だぞ。
20230325-161026-551	685.wav	朝刊の一面はこの記事でいこう。	Kawano	00000088/00088205.jpg	朝刊の一面はこの記事でいこう。
20230325-161026-551	686.wav	どうすれば電源が付くの？	Kawano	00000011/00011911.jpg	どうすれば電源が付くの？
20230325-161026-551	687.wav	う〜ん、あんまり美味しくないなー。	Kawano	00000109/00109877.jpg	う～ん、あんまり美味しくない。
20230325-161026-551	691.wav	ビンごとゆでちゃうの！	Kawano	00000076/00076767.jpg	ビンごとゆでちゃうの！
20230325-161026-551	692.wav	練習時間はあと5分しかないの	Kawano	00000018/00018011.jpg	練習時間はあと5分しかないよ
20230325-161026-551	694.wav	切り分けるわね。	Kawano	00000016/00016296.jpg	切り分けるわね。
20230325-161026-551	695.wav	いろいろ試着して比べてみましょう。	Kawano	00000054/00054973.jpg	いろいろ試着して比べてみましょう。
20230325-161026-551	697.wav	チェックインのお客様ですか？	Kawano	00000096/00096958.jpg	いらっしゃいませ、チェックインのお客様ですか？
20230325-161026-551	698.wav	この髪型はどう？	Kawano	00000037/00037702.jpg	この髪型はどう？もっと動いた方が良さが伝わるかしら。
20230325-161026-551	700.wav	さて、どこから筆を入れようかしら。	Kawano	00000029/00029713.jpg	さて、どこから筆を入れようかしら。
