session	filename	transcript	speaker	image	original_transcrippt
20230325-150539-579	396.wav	こうしてシューズの刃保護して置かないといけないんだ。	Yoshino	00000078/00078596.jpg	こうしてシューズの刃は保護して置かないとならないんだ。
20230325-150539-579	397.wav	みんなの昼ごはんをい写真に撮ろうよ。	Yoshino	00000012/00012555.jpg	みんなの昼ごはんを写真に撮ろうよ。
20230325-150539-579	398.wav	うりゃー	Yoshino	00000036/00036393.jpg	うりゃー
20230325-150539-579	399.wav	今日も私のトーク聴いてくれてありがとう。	Yoshino	00000088/00088214.jpg	今日も私のトーク聴いてくれてありがとう。
20230325-150539-579	400.wav	使い込んでるだろ？	Yoshino	00000083/00083001.jpg	使い込んでるだろ
20230325-150539-579	401.wav	赤い口紅イケてるでしょう？	Yoshino	00000055/00055298.jpg	赤い口紅イケてるでしょう？
20230325-150539-579	402.wav	この向きで貼り付けるのがいいと思うけど、どう？	Yoshino	00000070/00070097.jpg	この向きで貼り付けるのがいいと思うけど、どう？
20230325-150539-579	403.wav	服装は自由なの？	Yoshino	00000087/00087880.jpg	服装は自由なの
20230325-150539-579	404.wav	あれで見やすくなったでしょ？	Yoshino	00000058/00058953.jpg	あれで見やすくなったでしょ？
20230325-150539-579	405.wav	よし着地は上々。後ろはまだ着いて来てないわよね。	Yoshino	00000114/00114227.jpg	よし着地は上々。後ろはまだ着いて来ないわよね。
20230325-150539-579	406.wav	こども服は、どれを選ぼうかな。	Yoshino	00000028/00028428.jpg	こども服は、どれを選ぼうかな。
20230325-150539-579	407.wav	そろそろ暗くなりそうだから帰る用意をするよ。	Yoshino	00000103/00103998.jpg	そろそろ暗くなりそうだから帰る用意するよ。
20230325-150539-579	408.wav	これくらいは全然平気ですよ	Yoshino	00000059/00059420.jpg	これくらいは全然平気ですよ
20230325-150539-579	409.wav	この奥にアクセサリを仕舞ったはずなんだけど見つからないわ。	Yoshino	00000055/00055176.jpg	この奥にアクセサリを仕舞ったはずなんだけど見つからないわ。
20230325-150539-579	410.wav	音響機材の操作が間に合わないよ。	Yoshino	00000084/00084666.jpg	音響機材の操作が間に合わないよ。
20230325-150539-579	411.wav	一気飲みだよ	Yoshino	00000022/00022024.jpg	一気飲みだよ
20230325-150539-579	413.wav	ただいまの時間から店内商品全て20％オフです。	Yoshino	00000032/00032092.jpg	ただいまの時間から店内商品全て20％オフです。
20230325-150539-579	414.wav	んぎゃー	Yoshino	00000072/00072529.jpg	んぎゃー
20230325-150539-579	415.wav	誓います	Yoshino	00000022/00022635.jpg	誓います
20230325-150539-579	418.wav	脂身は取り除きます。	Yoshino	00000048/00048683.jpg	脂身は取り除きます。
20230325-150539-579	419.wav	今の気温こんなに低いよ、まだ雪もこの後に降るんだって	Yoshino	00000083/00083243.jpg	今の気温こんなに低いよ、まだ雪もこの後に降るんだって
20230325-150539-579	420.wav	お見舞いに来てくれてありがとう。	Yoshino	00000006/00006378.jpg	お見舞いに来てくれてありがとう。
20230325-150539-579	421.wav	どのキーを押せばいいの？	Yoshino	00000004/00004026.jpg	どのキーを押せばいいの？
20230325-150539-579	422.wav	後でその卵がかかってる部分、い一枚分けてくれる？	Yoshino	00000018/00018135.jpg	後でその卵がかかってる部分、一枚分けてくれる？
20230325-150539-579	423.wav	雑誌を買ってきてくれてありがとう。	Yoshino	00000072/00072950.jpg	雑誌を買ってきてくれてありがとう。
20230325-150539-579	424.wav	色んな惣菜があるけど買わないかい？	Yoshino	00000079/00079157.jpg	色んな惣菜あるけど買わないかい？
20230325-150539-579	425.wav	スケートボートを返すのはこうやっているの。	Yoshino	00000011/00011168.jpg	スケートボートを返すのはこうやってやるの。
20230325-150539-579	426.wav	こんばんは	Yoshino	00000096/00096771.jpg	こんばんは
20230325-150539-579	427.wav	メッチャ美味いよ	Yoshino	00000011/00011750.jpg	メッチャ美味いよ
20230325-150539-579	428.wav	シケた顔してるでしょ？	Yoshino	00000020/00020838.jpg	シケた顔してるでしょ？
20230325-150539-579	429.wav	明日のプランたてようか？	Yoshino	00000062/00062469.jpg	明日のプランたてようか？
20230325-150539-579	430.wav	コード余ってる？	Yoshino	00000077/00077902.jpg	コード有ってる？
20230325-150539-579	431.wav	では、自己紹介させていただきます。	Yoshino	00000026/00026379.jpg	では、自己紹介させていただきます。
20230325-150539-579	432.wav	ふんわり浮いている感じで頼むよ	Yoshino	00000019/00019240.jpg	ふんわり浮いている感じで頼むよ
20230325-150539-579	434.wav	ちょっと。こんな高そうなレストラン来て大丈夫なの？	Yoshino	00000097/00097732.jpg	ちょっと。こんな高そうなレストラン来て大丈夫なの？
20230325-150539-579	435.wav	いい？始めるよ？	Yoshino	00000038/00038044.jpg	いい？始めるよ？
20230325-150539-579	436.wav	がんばれ！	Yoshino	00000113/00113668.jpg	がんばれ！
20230325-150539-579	437.wav	四人とも同時に跳びあがってるかい？	Yoshino	00000102/00102306.jpg	四人とも同時に跳びあがっているかい？
20230325-150539-579	438.wav	この上に置いておいた僕のバッグ知らない？	Yoshino	00000117/00117392.jpg	この上に置いておいた僕のバッグを知らない？
20230325-150539-579	439.wav	マズくはないよ	Yoshino	00000012/00012110.jpg	マズくはないよ
20230325-150539-579	440.wav	テレビを観てるの	Yoshino	00000004/00004383.jpg	テレビを観てるの
20230325-150539-579	443.wav	スポークが折れてたんだよね	Yoshino	00000001/00001713.jpg	スポークが折れてたんだよね
20230325-150539-579	444.wav	お勧めですよ。	Yoshino	00000032/00032102.jpg	お勧めですよ。
20230325-150539-579	445.wav	文化祭に何をするか話合いましょ。	Yoshino	00000028/00028443.jpg	文化祭に何をするか話合いましょ。
20230325-150539-579	446.wav	私が捕まえた泥棒の事件のってるわ	Yoshino	00000022/00022522.jpg	私が捕まえた泥棒の事件のってるわ
20230325-150539-579	447.wav	走りますね。	Yoshino	00000114/00114038.jpg	走りますね。
20230325-150539-579	448.wav	今日は僕が片付ける日なんだ。	Yoshino	00000076/00076479.jpg	今日は僕が片付ける日なんだ。
20230325-150539-579	449.wav	コーナー菌が溜まりやすいので念入りに散布しましょう。	Yoshino	00000076/00076738.jpg	コーナーは菌が溜まりやすいので念入りに散布しましょう。
20230325-150539-579	452.wav	今日はタバコを何本吸ったか数えてみるよ。	Yoshino	00000017/00017040.jpg	今日はタバコを何本吸ったか数えてみるよ。
20230325-150539-579	453.wav	画像を送るから待って。	Yoshino	00000003/00003756.jpg	画像を送るから待って。
20230325-150539-579	454.wav	本日の料理はダイエット向けの小食メニューです。	Yoshino	00000076/00076808.jpg	本日の料理はダイエット向けの小食メニューです。
20230325-150539-579	455.wav	私のラッキーカラー黒です。	Yoshino	00000040/00040966.jpg	私のラッキーカラーは黒です。
20230325-150539-579	456.wav	あなた何故私に付いてくるんですか？	Yoshino	00000060/00060087.jpg	あなたは何故私に付いてくるのですか？
20230325-150539-579	457.wav	最後にこいつをのせるんだ。	Yoshino	00000099/00099125.jpg	最後にこいつをのせるんだ。
20230325-150539-579	458.wav	オーダー初めてですか。	Yoshino	00000101/00101678.jpg	オーダーは初めてですか。
20230325-150539-579	459.wav	一時しのぎの補修だけど、何とか頑張るよ。	Yoshino	00000001/00001626.jpg	一時しのぎの補修だけど、何とか頑張るよ。
20230325-150539-579	460.wav	先にご飯食べてますよ。	Yoshino	00000050/00050270.jpg	先にご飯食べますよ。
20230325-150539-579	461.wav	ミキサーでかき混ぜたら次は鍋で煮るんだ	Yoshino	00000016/00016250.jpg	ミキサーでかき混ぜたら次は鍋で煮るんだ
20230325-150539-579	462.wav	まず、右の正拳を入れる。そして、	Yoshino	00000081/00081005.jpg	まず、右の正拳を入れる。そして、
20230325-150539-579	463.wav	該当の資料はデーターベース上にないようです。	Yoshino	00000087/00087903.jpg	該当の資料はデーターベース上にはないようです。
20230325-150539-579	464.wav	どう近未来っぽくみえる？	Yoshino	00000088/00088542.jpg	どう近未来っぽくみえる？
20230325-150539-579	465.wav	すみませんが、研究室では撮影するのはご遠慮ください。	Yoshino	00000002/00002283.jpg	すみませんが、研究室では撮影するのはご遠慮ください。
20230325-150539-579	466.wav	この中から好きなものを選んじゃって良いのですか？	Yoshino	00000012/00012787.jpg	この中から好きなものを選んじゃって良いのですか？
20230325-150539-579	467.wav	夕飯の仕度をしてます。	Yoshino	00000076/00076978.jpg	夕飯の仕度をしています。
20230325-150539-579	469.wav	イスの配置はこのあたりでいいかしら？	Yoshino	00000022/00022083.jpg	イスの配置はこのあたりでよいかしら？
20230325-150539-579	470.wav	キャンドルいっぱいでしょう	Yoshino	00000087/00087029.jpg	キャンドルいっぱいでしょう
20230325-150539-579	471.wav	こうやって揺すって確認するんだ。	Yoshino	00000049/00049921.jpg	こうやって揺すって確認するんだ。
20230325-150539-579	472.wav	ここに植えればいいの?	Yoshino	00000002/00002025.jpg	ここに植えればいいの?
20230325-150539-579	473.wav	どこまで、あの選手は投げるかな？	Yoshino	00000114/00114257.jpg	どこまで、あの選手は投げるかな？。
20230325-150539-579	474.wav	ごめんなさい、もうしません。	Yoshino	00000020/00020710.jpg	ごめんなさい、申しません。
20230325-150539-579	475.wav	本物そっくりでしょう	Yoshino	00000029/00029177.jpg	本物そっくりでしょ
20230325-150539-579	476.wav	めんどくさい	Yoshino	00000020/00020260.jpg	めんどくさい
20230325-150539-579	477.wav	子供たちはこういうパズルを使ってアルファベット覚えるんですよ	Yoshino	00000087/00087445.jpg	子供たちはこういうパズルを使ってアルファベットを覚えるんですよ
20230325-150539-579	478.wav	自力で身体を動かすことが出来るかちょっと見てください。	Yoshino	00000070/00070330.jpg	自力で身体を動かすことが出来るかちょっと見ていてください。
20230325-150539-579	479.wav	雨が降りそうだから早めに広げたよ。商品が濡れたらたいへんだからね。	Yoshino	00000103/00103395.jpg	雨が降りそうだから早めに広げたよ。商品が濡れたらたいへんだからね。
20230325-150539-579	480.wav	フライングディスクとったどー。	Yoshino	00000007/00007293.jpg	フライングディスクとったどー。
20230325-150539-579	481.wav	デザートにはこのスイカお持ちします。	Yoshino	00000097/00097694.jpg	デザートにはこのスイカをお持ちします。
20230325-150539-579	482.wav	わかったわかった、起きるから大声出さないで	Yoshino	00000062/00062611.jpg	わかったわかった、起きるから大声出さないで
20230325-150539-579	483.wav	ほーら、かわいくできたでしょ	Yoshino	00000032/00032061.jpg	ほーら、かわいくできたでしょ
20230325-150539-579	484.wav	両手で混ぜるから早いよ。	Yoshino	00000005/00005066.jpg	両手で混ぜるから早いよ。
20230325-150539-579	485.wav	粘土で遊びます。	Yoshino	00000052/00052890.jpg	粘土で遊びます。
20230325-150539-579	486.wav	地味な工程でしょ？	Yoshino	00000066/00066717.jpg	地味な工程でしょ？
20230325-150539-579	488.wav	食器洗い手伝うよ？	Yoshino	00000004/00004198.jpg	食器洗い手伝うよ？
20230325-150539-579	489.wav	おーい、君も話し合いに参加したら？	Yoshino	00000119/00119120.jpg	おーい、君も話し合いに参加したら？
20230325-150539-579	490.wav	キャー噛まれたわ助けてー、なんてね	Yoshino	00000068/00068323.jpg	キャー噛まれたわ助けてー、なんてね
20230325-150539-579	491.wav	美味しそうな匂いがしてきたでしょ？	Yoshino	00000015/00015315.jpg	美味しそうな匂いがしてきたでしょ？
20230325-150539-579	492.wav	いぇ〜い	Yoshino	00000037/00037357.jpg	いぇ～い
20230325-150539-579	493.wav	生ハムはお好きですか。どうぞ食べてみて下さい。	Yoshino	00000097/00097315.jpg	生ハムはお好きですか。どうぞ食べてみて下さい。
20230325-150539-579	494.wav	今から、微調整するから	Yoshino	00000040/00040142.jpg	今から、微調整するから
20230325-150539-579	495.wav	案外暖かいでしょ	Yoshino	00000074/00074722.jpg	案外暖かいでしょ
20230325-150539-579	496.wav	このテープで固定しておきましょう。	Yoshino	00000022/00022901.jpg	このテープで固定しておきましょう。
20230325-150539-579	497.wav	すこし、お待ちください。	Yoshino	00000089/00089407.jpg	すこし、お待ちください。
20230325-150539-579	498.wav	ドライバーで飛ばすよ	Yoshino	00000064/00064234.jpg	ドライバーで飛ばすよ？
20230325-150539-579	499.wav	タレに絡めると本当に甘みが増しておいしい。	Yoshino	00000065/00065677.jpg	タレに絡めると本当に甘みが増しておいしい。
20230325-150539-579	500.wav	それでこのレシートの代金は誰が払うのですか？	Yoshino	00000010/00010871.jpg	それでこのレシートの代金は誰が払うのですか？
20230325-150539-579	501.wav	タバコがしけっちまうよー。	Yoshino	00000017/00017040.jpg	タバコがしけっちまうよー。
20230325-150539-579	502.wav	先ずは腹ごしらえよ	Yoshino	00000073/00073065.jpg	先ずは腹ごしらえよ
20230325-150539-579	503.wav	よおく火にかざすのです。	Yoshino	00000036/00036606.jpg	よおく火にかざすのです。
20230325-150539-579	504.wav	異常なし！	Yoshino	00000032/00032316.jpg	異常なし！
20230325-150539-579	505.wav	隠れておやつを食べているのがばれるからこっちを撮らないでください。	Yoshino	00000052/00052031.jpg	隠れておやつを食べているのがばれるからこっちを撮らないでください。
20230325-150539-579	506.wav	胸の事はほっといて下さい。セクハラですよ。	Yoshino	00000089/00089130.jpg	胸の事はほっといて下さい。セクハラですよ。
20230325-150539-579	507.wav	しっかりつかまってろよ！	Yoshino	00000095/00095389.jpg	しっかりつかまっていろよ！
20230325-150539-579	508.wav	乾いたら色付けよ	Yoshino	00000030/00030557.jpg	乾いたら色付けよ
20230325-150539-579	509.wav	今日は僕のDJで盛り上げるぞ。	Yoshino	00000036/00036580.jpg	今日は僕のDJで盛り上げるぞ。
20230325-150539-579	510.wav	僕の今までの練習の成果を聴いておくれ	Yoshino	00000043/00043965.jpg	僕の今までの練習の成果を聴いておくれ
20230325-150539-579	511.wav	揚げたてのフライ食べてみる？	Yoshino	00000017/00017385.jpg	揚げたてのフライを食べてみる？
20230325-150539-579	512.wav	カメラにおさめておきます	Yoshino	00000083/00083466.jpg	カメラにおさめておきます
20230325-150539-579	513.wav	ぴーす！	Yoshino	00000072/00072666.jpg	ぴーす！
20230325-150539-579	514.wav	焼きそば食べてかない？	Yoshino	00000000/00000645.jpg	焼きそば食べてかない？
20230325-150539-579	515.wav	君もタバコを吸いたいならあげるよ	Yoshino	00000003/00003508.jpg	君もタバコ吸いたいならあげるよ
20230325-150539-579	516.wav	へぇ、そうなんですか？	Yoshino	00000112/00112138.jpg	へぇ、そうなんですか？
20230325-150539-579	517.wav	じゃあ入刀しますよ	Yoshino	00000011/00011088.jpg	じゃあ入刀しますよ
20230325-150539-579	518.wav	へぇ、おいしい	Yoshino	00000090/00090523.jpg	へへへ、おいしー
20230325-150539-579	519.wav	採取した組織を顕微鏡で観察します。	Yoshino	00000002/00002229.jpg	採取した組織を顕微鏡で観察します。
20230325-150539-579	520.wav	ジャーンプ	Yoshino	00000114/00114549.jpg	ジャーンプ
20230325-150539-579	521.wav	誕生日ケーキを用意してくれてどうもありがとう。	Yoshino	00000014/00014592.jpg	誕生日ケーキを用意してくれてどうもありがとう。
20230325-150539-579	522.wav	上手に弾けてるでしょ？	Yoshino	00000086/00086217.jpg	上手に弾けているでしょ？
20230325-150539-579	523.wav	ブロッコリは嫌だ。	Yoshino	00000009/00009376.jpg	ブロッコリは嫌だ。
20230325-150539-579	524.wav	ちゃんと磨けてる？	Yoshino	00000000/00000256.jpg	チャンド磨けてる？
20230325-150539-579	525.wav	これテレビなの？私映るの？	Yoshino	00000004/00004948.jpg	コレテレビなの？私映るの？
20230325-150539-579	526.wav	日本を応援する絵を描いてます。これは津波で、トラは強いから日本の旗とトラを描きました。	Yoshino	00000027/00027434.jpg	ニホンを応援する絵をかいています。これは津波で、トラは強いから日本の旗とトラを描きました。
20230325-150539-579	527.wav	お前んち電子レンジあったか？	Yoshino	00000109/00109598.jpg	お前んち電子レンジあったか？
20230325-150539-579	528.wav	サイズはこれでよかった	Yoshino	00000055/00055198.jpg	サイズはこれでよかった？
20230325-150539-579	529.wav	テントを立てるのを、手伝ってもらえませんか？	Yoshino	00000050/00050330.jpg	テントを立てるのを、手伝ってもらえませんか？
20230325-150539-579	530.wav	きまった！	Yoshino	00000011/00011060.jpg	きまった！
20230325-150539-579	531.wav	きゃっ倒れる	Yoshino	00000054/00054559.jpg	きゃっ倒れる
20230325-150539-579	532.wav	海賊よ。	Yoshino	00000051/00051281.jpg	海賊よ。
20230325-150539-579	533.wav	どれにしようかしら？	Yoshino	00000055/00055329.jpg	どれにしょうかしら？
20230325-150539-579	534.wav	複数の香辛料をすり鉢に入れ、すりこぎで充分に潰します。	Yoshino	00000098/00098971.jpg	複数の香辛料をすり鉢に入れ、すりこぎで充分に潰します。
20230325-150539-579	535.wav	チアーズ！	Yoshino	00000097/00097598.jpg	チアーズ！
20230325-150539-579	536.wav	絵の具の上から固着剤をはるんですよ	Yoshino	00000074/00074228.jpg	絵の具の上から固着剤を塗るんですよ
20230325-150539-579	537.wav	料理を作ってもらったお礼に、皿洗いをするよ。	Yoshino	00000004/00004287.jpg	料理を作ってもらったお礼に、皿洗いをするよ。
20230325-150539-579	538.wav	麺棒を水平に転がして生地を薄く延ばします。	Yoshino	00000099/00099886.jpg	麺棒を水平に転がして生地を薄く延ばします。
20230325-150539-579	539.wav	これ、アルコール度数いくつのやつ	Yoshino	00000013/00013906.jpg	これ、アルコール度数いくつ！
20230325-150539-579	540.wav	そいつをやればいいの？	Yoshino	00000037/00037170.jpg	そいつをやればいいの？
20230325-150539-579	541.wav	中々来ないので、連絡してる所です。	Yoshino	00000006/00006859.jpg	中々来ないので、連絡している所です。
20230325-150539-579	542.wav	3Ｄのプログラムをこれから動かしてみるのだけど見てみますか？	Yoshino	00000008/00008182.jpg	3Ｄのプログラムをこれから動かしてみるのだけれど見てみますか？
20230325-150539-579	543.wav	やあ、おはよう	Yoshino	00000056/00056515.jpg	やあ、おはよう
20230325-150539-579	544.wav	旅の記録をその都度書き留めるのよ	Yoshino	00000004/00004726.jpg	旅の記録をその都度書き留めるのよ
20230325-150539-579	547.wav	野菜やすいかをカットしてポリ箱に入れましょう。	Yoshino	00000052/00052899.jpg	野菜やすいかをカットしてポリ箱に入れましょう。
20230325-150539-579	548.wav	次、負けたら、交代するよ。	Yoshino	00000019/00019296.jpg	次、負けたら、交代するよ。
20230325-150539-579	549.wav	いや，バナナボート乗れるぐらいの広さのお風呂ならバスタイムも楽しいだろうけど・・・って，普通のバナナかよっ！	Yoshino	00000009/00009130.jpg	いや，バナナボート乗れるぐらいの広さのお風呂ならバスタイムも楽しいだろうけど・・・って，普通のバナナかよっ！
20230325-150539-579	550.wav	ドールの衣装作りはハマると凝ってしまうんですね。	Yoshino	00000061/00061961.jpg	ドールの衣装作りはハマると凝ってしまうんですよ。
20230325-150539-579	551.wav	セクシーでしょ？	Yoshino	00000027/00027137.jpg	セクシーでしょ
20230325-150539-579	552.wav	いっぱいかくの	Yoshino	00000027/00027818.jpg	いっぱいかくの
20230325-150539-579	554.wav	ごらんなさいな、磨くと見違えるわ	Yoshino	00000051/00051032.jpg	ごらんなさいな、磨くと見違えるわ
20230325-150539-579	555.wav	綺麗な花でしょう	Yoshino	00000077/00077406.jpg	綺麗な花でしょ？
20230325-150539-579	556.wav	お前もこっちに来いよ、戦場でも息抜きは大事だろう。	Yoshino	00000116/00116020.jpg	お前もこっちに来いよ、戦場でも息抜きは大事だぞ。
20230325-150539-579	557.wav	特注のコーヒーメーカーだから、うちのコーヒーは本格派だよ。	Yoshino	00000056/00056171.jpg	特注のコーヒーメーカーだから、うちのコーヒーは本格派だよ。
20230325-150539-579	558.wav	朝刊の一面はこの記事でいこう。	Yoshino	00000088/00088205.jpg	朝刊の一面はこの記事でいこう。
20230325-150539-579	559.wav	どうすれば電源が付くの？	Yoshino	00000011/00011911.jpg	どうすれば電源が付くの？
20230325-150539-579	560.wav	う〜ん、あんまり美味しくない。	Yoshino	00000109/00109877.jpg	う～ん、あんまり美味しくない。
20230325-150539-579	561.wav	これ以上入らないから、カゴをもう一つ持ってきてちょうだい。	Yoshino	00000110/00110015.jpg	これ以上入らないから、カゴをもう一つ持ってきてちょうだい。
20230325-150539-579	562.wav	ビンごとゆでちゃうの	Yoshino	00000076/00076767.jpg	ビンごとゆでちゃうの！
20230325-150539-579	563.wav	練習時間はあと5分しかないよ	Yoshino	00000018/00018011.jpg	練習時間はあと5分しかないよ
20230325-150539-579	564.wav	切り分けるわね。	Yoshino	00000016/00016296.jpg	切り分けるわね。
20230325-150539-579	565.wav	いろいろ試着して比べてみましょう。	Yoshino	00000054/00054973.jpg	いろいろ試着して比べてみましょう。
20230325-150539-579	566.wav	いらっしゃいませ、チェックインのお客様ですか？	Yoshino	00000096/00096958.jpg	いらっしゃいませ、チェックインのお客様ですか？
20230325-150539-579	567.wav	この髪型はどう？もっと動いた方が良さが伝わるかしら。	Yoshino	00000037/00037702.jpg	この髪型はどう？もっと動いた方が良さが伝わるかしら。
20230325-150539-579	568.wav	さて、どこから筆を入れようかしら。	Yoshino	00000029/00029713.jpg	さて、どこから筆を入れようかしら。
20230325-150539-579	569.wav	両手と両足が使えたら作業量は二倍になるのにね。	Yoshino	00000018/00018977.jpg	両手と両足が使えたら作業量が二倍になるのにね。
20230325-150539-579	570.wav	このレシピで作るんですね？	Yoshino	00000098/00098636.jpg	このレシピで作るんですね？
20230325-150539-579	573.wav	試料のセットももうすぐ終わります。	Yoshino	00000009/00009163.jpg	試料のセットもうすぐ終わります。
20230325-150539-579	574.wav	取り敢えずネットの情報を掻き集めてみますね。	Yoshino	00000019/00019904.jpg	取り敢えずネットの情報を掻き集めてみますね。
20230325-150539-579	575.wav	この大きさの用紙なら五分程度で絵が描けるわ。	Yoshino	00000051/00051702.jpg	この大きさの用紙なら五分程度で絵が描けるわ。
20230325-150539-579	576.wav	もうすぐ直りますよ。	Yoshino	00000028/00028057.jpg	もうすぐ直りますよ。
20230325-150539-579	577.wav	仕事が全部終わって、今、片付けてるところです。	Yoshino	00000048/00048664.jpg	仕事が全部終わって、今、片付けているところよ。
20230325-150539-579	578.wav	エイエイ。	Yoshino	00000092/00092826.jpg	エイエイ。
