session	filename	transcript	speaker	image	original_transcrippt
20230325-150539-579	579.wav	冬に備えて、断熱加工は徹底的にやっておきます。	Yoshino	00000030/00030937.jpg	冬に備えて、断熱加工は徹底的にやっておきます。
20230325-150539-579	580.wav	その場でスライスして、お出ししています。	Yoshino	00000037/00037534.jpg	その場でスライスして、お出ししています。
20230325-150539-579	581.wav	エロすぎこん今日のおかず決定	Yoshino	00000023/00023098.jpg	エロすぎ　今日のおかず決定
20230325-150539-579	582.wav	この雑貨は新しく入荷したものですか？	Yoshino	00000068/00068283.jpg	この雑貨は新しく入荷したものですか？
20230325-154844-077	0.wav	祝福ありがとうございます	Yoshino	00000009/00009087.jpg	祝福ありがとうございます
20230325-154844-077	1.wav	すてきでしょ	Yoshino	00000073/00073018.jpg	すてきでしょ
20230325-154844-077	2.wav	くそっ。急に暴落しやがった。大損だぜ。	Yoshino	00000021/00021568.jpg	くそっ。急に暴落しやがった。大損だぜ。
20230325-154844-077	3.wav	くすぐったい！	Yoshino	00000117/00117105.jpg	くすぐったい！
20230325-154844-077	4.wav	私の後姿、どう？	Yoshino	00000077/00077738.jpg	私の後姿、どう？
20230325-154844-077	5.wav	料理の隠し味は液体窒素です。	Yoshino	00000099/00099099.jpg	料理の隠し味は液体窒素です。
20230325-154844-077	6.wav	まだ開店準備中です｡もう少しお待ちください	Yoshino	00000037/00037192.jpg	まだ開店準備中です｡もう少しお待ちください
20230325-154844-077	9.wav	お姉ちゃんと一緒にクリスマスの天使の仮装をしたのよ	Yoshino	00000010/00010808.jpg	お姉ちゃんと一緒にクリスマスの天使の仮装をしたのよ
20230325-154844-077	10.wav	若いころはギターで女の子をメロメロにしたもんさ。	Yoshino	00000043/00043965.jpg	若いころはギターで女の子をメロメロにしたもんさ。
20230325-154844-077	11.wav	編集をしている途中です。	Yoshino	00000111/00111967.jpg	編集をしている途中です。
20230325-154844-077	12.wav	コピーは何枚とればいいんだっけ？	Yoshino	00000088/00088858.jpg	コピーは何枚とればいいんだっけ？
20230325-154844-077	13.wav	受賞式は後日に改めて行います。	Yoshino	00000057/00057857.jpg	受賞式は後日に改めて行います。
20230325-154844-077	14.wav	ドリンクはここで受け取るのよ。	Yoshino	00000066/00066622.jpg	ドリンクはここで受け取るのよ。
20230325-154844-077	15.wav	私のマグカップどこにあるか知りませんか？	Yoshino	00000049/00049928.jpg	私のマグカップどこにあるか知りませんか？
20230325-154844-077	16.wav	このカップケーキの飾り付け、お願いね。	Yoshino	00000032/00032338.jpg	このカップケーキの飾り付け、お願いね。
20230325-154844-077	17.wav	今日は、お疲れ様でした。	Yoshino	00000052/00052378.jpg	今日は、お疲れ様でした。
20230325-154844-077	18.wav	チョコクッキー100個を１月い１日にご予約ですね。	Yoshino	00000056/00056779.jpg	チョコクッキー100個を１月１日にご予約ですね。
20230325-154844-077	19.wav	もちろん冷え冷えだよ！	Yoshino	00000037/00037225.jpg	もちろん冷え冷えだよ！
20230325-155017-589	0.wav	熱くなった鉄板に、こうして慎重にのせます。	Yoshino	00000099/00099434.jpg	熱くなった鉄板に、こうして慎重にのせます。
20230325-155017-589	1.wav	酔いつぶれて動けないの	Yoshino	00000017/00017464.jpg	酔いつぶれて動けないの
20230325-155017-589	2.wav	はかりますね。	Yoshino	00000057/00057107.jpg	はかりますね。
20230325-155017-589	3.wav	これを少量足して、あとは混ぜれば出来上がりです。	Yoshino	00000036/00036759.jpg	これを少量足して、あとは混ぜれば出来上がりです。
20230325-155017-589	4.wav	ごみはごみ箱へ捨てよう	Yoshino	00000102/00102630.jpg	ごみはごみ箱へ捨てよう
20230325-155017-589	5.wav	これ、あなたの好物だったわよね？	Yoshino	00000109/00109715.jpg	これ、あなたの好物だったわよね？
20230325-155017-589	6.wav	カメラ係りをありがとう。	Yoshino	00000072/00072666.jpg	カメラ係りありがとう。
20230325-155017-589	7.wav	僕がＤＪをやらせていただきます。	Yoshino	00000084/00084640.jpg	僕がＤＪをやらせていただきます。
20230325-155017-589	8.wav	あと何個分刻めばいいの？	Yoshino	00000008/00008810.jpg	あと何個分刻めばいいの？
20230325-155017-589	9.wav	まっすぐ線をしつか引くのは気を使うんで話しかけないで	Yoshino	00000029/00029853.jpg	まっすぐ線を引くのは気を使うんで話しかけないでくれ
20230325-155017-589	10.wav	ドーナツ食べる？	Yoshino	00000017/00017755.jpg	ドーナッツ食べる？
20230325-155017-589	11.wav	見てごらんよ、この大きなカブ。久しぶりにこんな大きなカブが育ったわ。	Yoshino	00000116/00116587.jpg	見てごらんよ、この大きなカブ。久しぶりにこんな大きなカブが育ったわ。
20230325-155017-589	12.wav	さぁ、これでできあがり。お待たせしました。	Yoshino	00000099/00099976.jpg	さぁ、これでできあがり。お待たせしました。
20230325-155017-589	13.wav	ぼく今大工だから、ドリルで穴をあける仕事をしてるの。	Yoshino	00000092/00092607.jpg	ぼく今大工さんだから、ドリルで穴をあける仕事してるの。
20230325-155017-589	14.wav	よし、ごちそうだぞ。	Yoshino	00000021/00021559.jpg	おっし、ごちそうだぞ。
20230325-155017-589	15.wav	お客さんがいないからカウンターで寝ちゃおうかしら？	Yoshino	00000036/00036963.jpg	お客さんがいないからカウンターで寝ちゃおうかしら？
20230325-155017-589	16.wav	ワインに合うおつまみを注文しようかしら。	Yoshino	00000097/00097554.jpg	ワインに合うおつまみ注文しようかしら。
20230325-155017-589	17.wav	予習してるから静かにしてて。	Yoshino	00000003/00003009.jpg	予習してるから静かにしてて。
20230325-155017-589	18.wav	これがただの筒だと思ったら大間違いです。	Yoshino	00000068/00068173.jpg	これがただの筒だと思ったら大間違いです。
20230325-155017-589	19.wav	休暇中なのに、仕事のメールは返さないといけないのよね。	Yoshino	00000117/00117061.jpg	休暇中なのに、仕事のメールは返さないといけないのよね。
20230325-155017-589	20.wav	大体1ヶ月ぐらいはかかりますね。	Yoshino	00000029/00029722.jpg	大体1ヶ月くらいはかかりますね。
20230325-155017-589	21.wav	重いバケツを担ぐのは一苦労だよ。	Yoshino	00000002/00002855.jpg	重いバケツを担ぐのは一苦労だよ。
20230325-155017-589	22.wav	ゲームで本格的なボウリング体験できるらしい。どんなものか試しているところだ。	Yoshino	00000018/00018187.jpg	ゲームで本格的なボウリングを体験できるらしい。どんなものか試しているところだ。
20230325-155017-589	23.wav	えーっと、もうしゃべっていいの？	Yoshino	00000043/00043273.jpg	えっと、もうしゃべってもいいの？
20230325-155017-589	24.wav	今、試験中なので話かけないで下さい。	Yoshino	00000006/00006193.jpg	今、試験中なので話かけないで下さい。
20230325-155017-589	25.wav	今日仕入れたばっかりだよ	Yoshino	00000049/00049027.jpg	今日仕入れたばっかりだよ
20230325-155017-589	26.wav	チャンネル変えるよ	Yoshino	00000006/00006726.jpg	チャンネル変えるよ
20230325-155017-589	27.wav	化粧なおしたら出かけましょうか？	Yoshino	00000020/00020404.jpg	化粧なおしたら出かけましょうか？
20230325-155017-589	28.wav	かしこく見える？	Yoshino	00000004/00004026.jpg	かしこく見える？
20230325-155017-589	29.wav	図書館内ではフラッシュなんて焚かないでよ	Yoshino	00000014/00014082.jpg	図書館内ではフラッシュなんか焚かないでよ？
20230325-155017-589	30.wav	荷台にモノを載せすぎて進みにくいです。	Yoshino	00000002/00002966.jpg	荷台にモノを載せすぎて進みにくいです。
20230325-155017-589	31.wav	すごい風船の数でしょ？	Yoshino	00000089/00089199.jpg	すごい風船の数でしょ？
20230325-155017-589	32.wav	キャディーさん写さなくても良くないですか?	Yoshino	00000069/00069055.jpg	キャディーさんは写さなくても良くないですか?
20230325-155017-589	33.wav	このゲームを始めてから、どのぐらい時間が経ってる？	Yoshino	00000014/00014693.jpg	このゲームを始めてから、どのくらい時間が経ってる？
20230325-155017-589	34.wav	輪行はいいですよ。	Yoshino	00000009/00009794.jpg	輪行はいいですよ。
20230325-155017-589	35.wav	今、ドリンクを注いでます。	Yoshino	00000056/00056236.jpg	今、ドリンク注いでます。
20230325-155017-589	36.wav	スタジオにこもりっぱなしで、なんだか仙人の気分だよ。	Yoshino	00000085/00085926.jpg	スタジオにこもりっぱなしで、なんだか仙人の気分だよ。
20230325-155017-589	37.wav	ニンジンのヘタを全て取ります。	Yoshino	00000001/00001093.jpg	ニンジンのヘタを全て取ります。
20230325-155017-589	38.wav	んー、そうだねぇ	Yoshino	00000018/00018310.jpg	んー、そうだねぇ
20230325-155017-589	39.wav	天板に均等に絞り出します。	Yoshino	00000032/00032260.jpg	天板に均等に絞り出します。
20230325-155017-589	40.wav	ヘイおまち	Yoshino	00000099/00099323.jpg	ヘイおまち
20230325-155017-589	41.wav	お皿を洗うから明日は海に連れていってね。	Yoshino	00000004/00004190.jpg	お皿を洗うから明日は海に連れていってね。
20230325-155017-589	42.wav	皆描き終ってるの？	Yoshino	00000029/00029419.jpg	皆描き終ってるの？
20230325-155017-589	43.wav	席に座れないよ。	Yoshino	00000104/00104269.jpg	席に座れないよ。
20230325-155017-589	44.wav	缶飲料は紙コップに移し変えます。	Yoshino	00000002/00002876.jpg	缶飲料は紙コップに移し変えます。
20230325-155017-589	45.wav	これ火つけると、炎がグワーっと上がったりしない？怖いわ！	Yoshino	00000015/00015207.jpg	これ火をつけると、炎がグワーっと上がったりしない？怖いわ！
20230325-161026-551	307.wav	えー床に、どんなじゅうたんを敷こうか？	Kawano	00000090/00090799.jpg	床に、どんなじゅうたんを敷こうか？
20230325-161026-551	308.wav	この人さっきから微動だにしないのよすごいと思わない？	Kawano	00000042/00042202.jpg	この人さっきから微動だにしないのよすごいと思わない？
20230325-161026-551	309.wav	±１００ｇまでだね	Kawano	00000030/00030133.jpg	±１００ｇまでだね
20230325-161026-551	310.wav	ごめんなさい、今歯磨き中なの	Kawano	00000007/00007719.jpg	ごめんなさい、今歯磨き中なの
20230325-161026-551	311.wav	PCを２台も操るなんて、デキる女でしょ？	Kawano	00000015/00015271.jpg	PCを２台も操るなんて、デキる女でしょ？
20230325-161026-551	312.wav	私もグラスを持てばいいの？	Kawano	00000021/00021376.jpg	私もグラスを持てばいいの？
20230325-161026-551	313.wav	僕のキャリーバッグかっこいいでしょ？	Kawano	00000020/00020068.jpg	僕のキャリーバッグかっこいいでしょ？
20230325-161026-551	314.wav	今日はパーティーよ！	Kawano	00000110/00110126.jpg	今日はパーティーよ！
20230325-161026-551	315.wav	飲み物を入れますから少々お待ちくださいね。	Kawano	00000002/00002900.jpg	飲み物を入れますから少々お待ちくださいね。
20230325-161026-551	316.wav	どんな映像に仕上がったんだい？	Kawano	00000058/00058858.jpg	どんな映像に仕上がったんだい？
20230325-161026-551	317.wav	雨の中待ってるのに連絡が取れないの。	Kawano	00000008/00008176.jpg	雨の中待ってるのに連絡が取れないの。
20230325-161026-551	318.wav	銃の手入れはこまめにしないとな	Kawano	00000115/00115726.jpg	銃の手入れはこまめにしないとな
20230325-161026-551	319.wav	うちは豚の丸焼きありますよ	Kawano	00000048/00048743.jpg	うちは豚の丸焼きありますよ
20230325-161026-551	320.wav	間もなく始まります	Kawano	00000107/00107391.jpg	間もなく始まります
20230325-161026-551	321.wav	一息つきましたね。	Kawano	00000056/00056276.jpg	一息つきましたね。
20230325-161026-551	322.wav	すぐ出発する。支度は済ませたか？	Kawano	00000090/00090469.jpg	すぐ出発する。支度は済ませたか？
20230325-161026-551	323.wav	この容器に何て書いてある？	Kawano	00000040/00040267.jpg	この容器に何て書いてある？
20230325-161026-551	324.wav	お父さん、晩酌ですよ	Kawano	00000002/00002903.jpg	お父さん、晩酌ですよ
20230325-161026-551	325.wav	ネコと遊ぶのはストレス発散になるよ。	Kawano	00000088/00088845.jpg	ネコと遊ぶのはストレス発散になるよ。
20230325-161026-551	326.wav	メンマ多めでしたよね。	Kawano	00000099/00099506.jpg	メンマ多めでしたよね。
20230325-161026-551	327.wav	収録の邪魔しないでね	Kawano	00000086/00086727.jpg	収録の邪魔をしないでね
20230325-161026-551	328.wav	少しオマケしておくよ。	Kawano	00000008/00008501.jpg	少しオマケしておくよ。
20230325-161026-551	329.wav	ビールは僕がついであげるよ。	Kawano	00000002/00002891.jpg	ビールは僕がついであげるよ。
20230325-161026-551	330.wav	この化粧品、私に似合うと思う？	Kawano	00000041/00041218.jpg	この化粧品、私に似合うと思う？
20230325-161026-551	331.wav	この一番上のパックがよさそうだと思うけどどう思う？	Kawano	00000049/00049184.jpg	この一番上のパックがよさそうだと思うけどどう？
20230325-161026-551	332.wav	続いて、嬉しいニュースをお伝えします	Kawano	00000087/00087855.jpg	続いて、嬉しいニュースをお伝えします
20230325-161026-551	333.wav	そろそろ洗い終わるよ	Kawano	00000076/00076479.jpg	そろそろ洗い終わるよ
20230325-161026-551	334.wav	あなたも飲むでしょ？コップを頂戴。	Kawano	00000002/00002929.jpg	あなたも飲むでしょ？コップを頂戴。
20230325-161026-551	335.wav	今着ていた物も、洗濯機にはい入れちゃった。	Kawano	00000077/00077507.jpg	今着ていた物も、洗濯機に入れちゃった。
20230325-161026-551	336.wav	ワゴンセールのものを何冊か買うけど、あなたはいらないの？	Kawano	00000007/00007071.jpg	ワゴンセールのものを何冊か買うけど、あなたはいらないの？
20230325-161026-551	337.wav	カップいっぱい有るね	Kawano	00000019/00019703.jpg	カップいっぱい有るね
20230325-161026-551	338.wav	表面が焼けたのでコショウをかけます	Kawano	00000099/00099037.jpg	表面が焼けたのでコショウをかけます
20230325-161026-551	341.wav	キャビアを添えます。	Kawano	00000098/00098457.jpg	キャビアを添えます。
20230325-161026-551	342.wav	もう少し深く掘りましょう	Kawano	00000074/00074790.jpg	もう少し深く掘りましょう
20230325-161026-551	343.wav	単純作業は疲れるよ	Kawano	00000076/00076948.jpg	単純作業は疲れるよ
20230325-161026-551	344.wav	私達の並びはクリスマスツリーみたいでしょ？	Kawano	00000010/00010808.jpg	私達の並びクリスマスツリーみたいでしょ
20230325-161026-551	349.wav	パンケーキはまだか	Kawano	00000037/00037490.jpg	パンケーキはまだか
20230325-161026-551	350.wav	あ、いらっしゃい	Kawano	00000027/00027661.jpg	あ、いらっしゃい
20230325-161026-551	353.wav	見つかったか。	Kawano	00000092/00092136.jpg	見つかったか。
20230325-161026-551	354.wav	今日の昼食はピザだよ。	Kawano	00000018/00018000.jpg	今日の昼食はピザだよ。
20230325-161026-551	357.wav	ブンブン、危ないですよ。	Kawano	00000015/00015926.jpg	ブンブン、危ないですよ。
20230325-161026-551	358.wav	この装置に検査薬を入れてみますね。	Kawano	00000088/00088461.jpg	この装置に検査薬を入れてみますね。
20230325-161026-551	359.wav	祝福ありがとうございます	Kawano	00000009/00009087.jpg	祝福ありがとうございます
20230325-161026-551	360.wav	すてきでしょ	Kawano	00000073/00073018.jpg	すてきでしょ
20230325-161026-551	361.wav	くそっ。急に暴落しやがった。大損だぜ。	Kawano	00000021/00021568.jpg	くそっ。急に暴落しやがった。大損だぜ。
20230325-161026-551	362.wav	くすぐったい！	Kawano	00000117/00117105.jpg	くすぐったい！
20230325-161026-551	363.wav	私の後姿、どう？	Kawano	00000077/00077738.jpg	私の後姿、どう？
20230325-161026-551	364.wav	料理の隠し味は液体窒素です。	Kawano	00000099/00099099.jpg	料理の隠し味は液体窒素です。
20230325-161026-551	371.wav	編集をしてる途中です。	Kawano	00000111/00111967.jpg	編集をしている途中です。
20230325-161026-551	372.wav	コピーは何枚とればいいんだっ	Kawano	00000088/00088858.jpg	コピーは何枚とればいいんだっけ？
20230325-161026-551	374.wav	受賞式は後日に改めて行います。	Kawano	00000057/00057857.jpg	受賞式は後日に改めて行います。
20230325-161026-551	375.wav	ドリンクはここで受け取るのよ。	Kawano	00000066/00066622.jpg	ドリンクはここで受け取るのよ。
20230325-161026-551	376.wav	私のマグカップどこにあるか知りませんか？	Kawano	00000049/00049928.jpg	私のマグカップどこにあるか知りませんか？
20230325-161026-551	377.wav	このカップケーキの飾り付け、おとりお願いね。	Kawano	00000032/00032338.jpg	このカップケーキの飾り付け、お願いね。
20230325-161026-551	378.wav	今日は、お疲れ様でした。	Kawano	00000052/00052378.jpg	今日は、お疲れ様でした。
20230325-161026-551	381.wav	もちろん冷え冷えだよ！	Kawano	00000037/00037225.jpg	もちろん冷え冷えだよ！
20230325-161026-551	382.wav	どうだいこのビート。	Kawano	00000084/00084028.jpg	どうだいこのビート。
20230325-161026-551	385.wav	ソースはたっぷり掛けておくよ。	Kawano	00000014/00014636.jpg	ソースはたっぷり掛けておくよ。
20230325-161026-551	388.wav	酔いつぶれて動けないの	Kawano	00000017/00017464.jpg	酔いつぶれて動けないの
20230325-161026-551	389.wav	はかりますね。	Kawano	00000057/00057107.jpg	はかりますね。
20230325-161026-551	392.wav	ごみはごみ箱へ捨てよう	Kawano	00000102/00102630.jpg	ごみはごみ箱へ捨てよう
20230325-161026-551	393.wav	これ、あなたの好物だったわよね？	Kawano	00000109/00109715.jpg	これ、あなたの好物だったわよね？
20230325-161026-551	394.wav	カメラ係りありがとう。	Kawano	00000072/00072666.jpg	カメラ係りありがとう。
20230325-161026-551	395.wav	僕がＤＪをやらせていただきます。	Kawano	00000084/00084640.jpg	僕がＤＪをやらせていただきます。
20230325-161026-551	396.wav	あと何個分刻めばいいの？	Kawano	00000008/00008810.jpg	あと何個分刻めばいいの？
20230325-161026-551	399.wav	ドーナツ食べる？	Kawano	00000017/00017755.jpg	ドーナッツ食べる？
20230325-161026-551	400.wav	見てごらんよ、この大きなカブ。	Kawano	00000116/00116587.jpg	見てごらんよ、この大きなカブ。久しぶりにこんな大きなカブが育ったわ。
20230325-161026-551	405.wav	ドリルで穴をあける仕事をしてるの。	Kawano	00000092/00092607.jpg	ぼく今大工さんだから、ドリルで穴をあける仕事してるの。
20230325-161026-551	406.wav	おっし、ごちそうだぞ。	Kawano	00000021/00021559.jpg	おっし、ごちそうだぞ。
20230325-161026-551	408.wav	カウンターで寝ちゃおうかしら？	Kawano	00000036/00036963.jpg	お客さんがいないからカウンターで寝ちゃおうかしら？
20230325-161026-551	409.wav	ワインに合うおつまみ注文しようかしら。	Kawano	00000097/00097554.jpg	ワインに合うおつまみ注文しようかしら。
20230325-161026-551	411.wav	予習してるから静かにしてて。	Kawano	00000003/00003009.jpg	予習してるから静かにしてて。
20230325-161026-551	412.wav	これがただの筒だと思ったら大間違いです。	Kawano	00000068/00068173.jpg	これがただの筒だと思ったら大間違いです。
20230325-161026-551	415.wav	大体1ヶ月ぐらいかかりますね。	Kawano	00000029/00029722.jpg	大体1ヶ月くらいはかかりますね。
20230325-161026-551	416.wav	重いバケツを担ぐのは一苦労だよ。	Kawano	00000002/00002855.jpg	重いバケツを担ぐのは一苦労だよ。
20230325-161026-551	419.wav	えっと、もうしゃべってもいいの？	Kawano	00000043/00043273.jpg	えっと、もうしゃべってもいいの？
20230325-161026-551	420.wav	今、試験中なので話かけないで下さい。	Kawano	00000006/00006193.jpg	今、試験中なので話かけないで下さい。
20230325-161026-551	421.wav	今日仕入れたばっかりだよ	Kawano	00000049/00049027.jpg	今日仕入れたばっかりだよ
20230325-161026-551	422.wav	チャンネル変えるよ	Kawano	00000006/00006726.jpg	チャンネル変えるよ
20230325-161026-551	423.wav	化粧なおしたら出かけましょうか？	Kawano	00000020/00020404.jpg	化粧なおしたら出かけましょうか？
20230325-161026-551	424.wav	かしこく見える？	Kawano	00000004/00004026.jpg	かしこく見える？
20230325-161026-551	425.wav	図書館内ではフラッシュなんかた焚かないでよ	Kawano	00000014/00014082.jpg	図書館内ではフラッシュなんか焚かないでよ？
20230325-161026-551	426.wav	荷台にモノを載せすぎて進みにくいです。	Kawano	00000002/00002966.jpg	荷台にモノを載せすぎて進みにくいです。
20230325-161026-551	427.wav	ものすごい風船の数でしょ？	Kawano	00000089/00089199.jpg	すごい風船の数でしょ？
20230325-161026-551	428.wav	キャディーさんは写さなくても良くないですか?	Kawano	00000069/00069055.jpg	キャディーさんは写さなくても良くないですか?
20230325-161026-551	433.wav	ドリンク注いでいます。	Kawano	00000056/00056236.jpg	今、ドリンク注いでます。
20230325-161026-551	436.wav	ニンジンのヘタを全て取ります。	Kawano	00000001/00001093.jpg	ニンジンのヘタを全て取ります。
20230325-161026-551	437.wav	んー、そうだねぇ	Kawano	00000018/00018310.jpg	んー、そうだねぇ
20230325-161026-551	438.wav	天板に均等に絞り出します。	Kawano	00000032/00032260.jpg	天板に均等に絞り出します。
20230325-161026-551	439.wav	ヘイおまち	Kawano	00000099/00099323.jpg	ヘイおまち
20230325-161026-551	441.wav	明日は海に連れていってね。	Kawano	00000004/00004190.jpg	お皿を洗うから明日は海に連れていってね。
20230325-161026-551	442.wav	皆描き終ってるの？	Kawano	00000029/00029419.jpg	皆描き終ってるの？
20230325-161026-551	443.wav	席に座れないよ。	Kawano	00000104/00104269.jpg	席に座れないよ。
20230325-161026-551	445.wav	紙コップに移し変えます。	Kawano	00000002/00002876.jpg	缶飲料は紙コップに移し変えます。
20230325-161026-551	446.wav	これ火をつけると、炎がグワーっと上がったりしない？	Kawano	00000015/00015207.jpg	これ火をつけると、炎がグワーっと上がったりしない？怖いわ！
20230325-161026-551	448.wav	とりあえず、今日の予定を組んでおかないと。	Kawano	00000078/00078686.jpg	とりあえず、今日の予定を組んでおかないと。
20230325-161026-551	449.wav	今日は一体どんな用件で？	Kawano	00000016/00016831.jpg	今日は一体どんな用件で？
20230325-161026-551	450.wav	洋服も全部出すよ。	Kawano	00000054/00054605.jpg	洋服も全部出すよ。
20230325-161026-551	451.wav	またあいつ寝坊か？	Kawano	00000086/00086554.jpg	またあいつ寝坊か？
20230325-161026-551	452.wav	どう、やわらかいでしょ？	Kawano	00000041/00041981.jpg	どう、やわらかいでしょ？
20230325-161026-551	457.wav	机の上は僕が片づけるから触らないで。	Kawano	00000017/00017654.jpg	机の上は僕が片づけるから触らないで。
20230325-161026-551	458.wav	もう出来上がるわよ	Kawano	00000000/00000638.jpg	もう出来上がるわよ
20230325-161026-551	459.wav	ヒジャブ無しでいいかしら	Kawano	00000021/00021173.jpg	ひじゃぶ無しでいいかしら
20230325-161026-551	460.wav	学校であった授業の復習です。	Kawano	00000088/00088922.jpg	学校であった授業の復習です。
